{
  "schemaVersion": "reading-order-v2-annotation-v1",
  "pageId": "H16",
  "readingOrder": [
    "ro2h-H16-r001",
    "ro2h-H16-r002",
    "ro2h-H16-r004",
    "ro2h-H16-r003",
    "ro2h-H16-r005"
  ],
  "unscoredRegionIds": [],
  "qualificationPairs": [
    {
      "id": "ro2h-H16-q001",
      "earlier": "ro2h-H16-r001",
      "later": "ro2h-H16-r002",
      "slices": [
        "B",
        "A+B",
        "mixed"
      ]
    },
    {
      "id": "ro2h-H16-q002",
      "earlier": "ro2h-H16-r002",
      "later": "ro2h-H16-r004",
      "slices": [
        "A",
        "B",
        "A+B",
        "mixed",
        "partial-assignment"
      ]
    },
    {
      "id": "ro2h-H16-q003",
      "earlier": "ro2h-H16-r004",
      "later": "ro2h-H16-r003",
      "slices": [
        "A",
        "A+B",
        "partial-assignment"
      ]
    }
  ],
  "layoutTags": [
    "partial-assignment",
    "combined-a-b",
    "mixed",
    "border-stressor",
    "ambiguous-membership"
  ],
  "panels": [
    {
      "id": "p-right",
      "bbox": {
        "x": 650,
        "y": 160,
        "width": 670,
        "height": 1320
      },
      "precedencePosition": 0
    },
    {
      "id": "p-left",
      "bbox": {
        "x": 120,
        "y": 420,
        "width": 660,
        "height": 1320
      },
      "precedencePosition": 1
    }
  ],
  "orientationExpectations": [
    {
      "regionId": "ro2h-H16-r001",
      "expected": "horizontal"
    },
    {
      "regionId": "ro2h-H16-r002",
      "expected": "vertical"
    },
    {
      "regionId": "ro2h-H16-r003",
      "expected": "vertical"
    },
    {
      "regionId": "ro2h-H16-r004",
      "expected": "horizontal"
    },
    {
      "regionId": "ro2h-H16-r005",
      "expected": "horizontal"
    }
  ],
  "assignmentExpectations": [
    {
      "regionId": "ro2h-H16-r001",
      "expected": "unique",
      "panelId": "p-right"
    },
    {
      "regionId": "ro2h-H16-r002",
      "expected": "unique",
      "panelId": "p-right"
    },
    {
      "regionId": "ro2h-H16-r003",
      "expected": "unique",
      "panelId": "p-left"
    },
    {
      "regionId": "ro2h-H16-r004",
      "expected": "ambiguous",
      "panelId": null
    },
    {
      "regionId": "ro2h-H16-r005",
      "expected": "unique",
      "panelId": "p-left"
    }
  ]
}
