{
  "schemaVersion": "reading-order-v2-annotation-v1",
  "pageId": "H15",
  "readingOrder": [
    "ro2h-H15-r001",
    "ro2h-H15-r002",
    "ro2h-H15-r005",
    "ro2h-H15-r003",
    "ro2h-H15-r004"
  ],
  "unscoredRegionIds": [],
  "qualificationPairs": [
    {
      "id": "ro2h-H15-q001",
      "earlier": "ro2h-H15-r001",
      "later": "ro2h-H15-r002",
      "slices": [
        "B",
        "A+B",
        "horizontal-only"
      ]
    },
    {
      "id": "ro2h-H15-q002",
      "earlier": "ro2h-H15-r002",
      "later": "ro2h-H15-r005",
      "slices": [
        "A",
        "A+B",
        "partial-assignment",
        "intentional-fallback"
      ]
    },
    {
      "id": "ro2h-H15-q003",
      "earlier": "ro2h-H15-r005",
      "later": "ro2h-H15-r003",
      "slices": [
        "A",
        "A+B",
        "partial-assignment"
      ]
    }
  ],
  "layoutTags": [
    "partial-assignment",
    "intentional-fallback",
    "combined-a-b",
    "horizontal-run",
    "unrelated-uncertain-region"
  ],
  "panels": [
    {
      "id": "p-right",
      "bbox": {
        "x": 760,
        "y": 180,
        "width": 560,
        "height": 1160
      },
      "precedencePosition": 0
    },
    {
      "id": "p-left",
      "bbox": {
        "x": 120,
        "y": 400,
        "width": 520,
        "height": 1260
      },
      "precedencePosition": 1
    }
  ],
  "orientationExpectations": [
    {
      "regionId": "ro2h-H15-r001",
      "expected": "horizontal"
    },
    {
      "regionId": "ro2h-H15-r002",
      "expected": "horizontal"
    },
    {
      "regionId": "ro2h-H15-r003",
      "expected": "vertical"
    },
    {
      "regionId": "ro2h-H15-r004",
      "expected": "vertical"
    },
    {
      "regionId": "ro2h-H15-r005",
      "expected": "horizontal"
    }
  ],
  "assignmentExpectations": [
    {
      "regionId": "ro2h-H15-r001",
      "expected": "unique",
      "panelId": "p-right"
    },
    {
      "regionId": "ro2h-H15-r002",
      "expected": "unique",
      "panelId": "p-right"
    },
    {
      "regionId": "ro2h-H15-r003",
      "expected": "unique",
      "panelId": "p-left"
    },
    {
      "regionId": "ro2h-H15-r004",
      "expected": "unique",
      "panelId": "p-left"
    },
    {
      "regionId": "ro2h-H15-r005",
      "expected": "outside",
      "panelId": null
    }
  ]
}
